{
  "result_version": "0.1.0",
  "result_id": "7ec88c9b-c8ef-5081-b068-ea6d1a3b0966",
  "origin": "simulated",
  "status": "CONSTRUCTION_ZONE_DECLARED_QUARANTINE_EVIDENCE_MISSING_STAGING_BLOCKED",
  "assessed_at": "2026-07-13T19:12:00Z",
  "zone_id": "46295d08-2990-4f04-a207-e9cc298b99c5",
  "zone_digest": "sha256:ff9237dec84c196f13eced8ad571942083d732b4bea7273d8ac9d52f012622c6",
  "receipt_id": "00cffec9-4ccc-4077-9292-1d0aff7f29b6",
  "receipt_digest": "sha256:4f90f7fac47fcbac73625e922d014bf452471691b1bf028bf9c9db1dafd7b51b",
  "staging_authorization_id": "c0ef9fcc-126e-4aab-98aa-2273fd2178aa",
  "staging_authorization_digest": "sha256:41a7224ccc920de29b8ca776674babc6c6455ba945b16871ac3b76e5910dc521",
  "zone_control_count": 10,
  "verified_zone_control_count": 0,
  "quarantine_requirement_count": 8,
  "verified_quarantine_requirement_count": 0,
  "source_archive_count": 0,
  "construction_zone_provisioned": false,
  "quarantine_evidence_complete": false,
  "staging_authorized": false,
  "build_authorized": false,
  "range_connection_authorized": false,
  "execution_authorized": false,
  "blockers": [
    "CONSTRUCTION_ZONE_CONTROLS_UNVERIFIED",
    "CONSTRUCTION_ZONE_NOT_PROVISIONED",
    "CONTENT_DIGEST_NOT_RETAINED",
    "ISOLATED_CONSTRUCTION_ZONE_MISSING",
    "OWNER_ATTESTATION_MISSING",
    "OWNER_EXCLUSION_REGISTRY_INCOMPLETE",
    "OWNER_SCOPE_PROOF_MISSING",
    "PINNED_COMMIT_SIGNATURE_UNVERIFIED",
    "QUARANTINE_EVIDENCE_MISSING",
    "SOURCE_ARCHIVE_NOT_STAGED",
    "SOURCE_STAGING_AUTHORIZATION_DENIED"
  ],
  "activity": {
    "repository_content_downloaded": false,
    "source_archive_staged": false,
    "source_extracted": false,
    "quarantine_checks_performed": false,
    "dependency_resolution_performed": false,
    "replica_built": false,
    "infrastructure_provisioned": false,
    "public_host_contacted_for_testing": false,
    "range_connected": false,
    "campaign_executed": false,
    "construction_zone_provisioned": false,
    "identity_created": false,
    "storage_created": false,
    "network_policy_applied": false,
    "kill_control_installed": false,
    "source_ingress_mounted": false,
    "output_store_created": false,
    "scanner_executed": false,
    "sbom_generated": false
  },
  "authority": {
    "can_download_source": false,
    "can_stage_source": false,
    "can_extract_source": false,
    "can_resolve_dependencies": false,
    "can_build_replica": false,
    "can_provision": false,
    "can_connect": false,
    "can_execute": false,
    "can_target_public_host": false,
    "can_authorize_action": false
  }
}
